{
  "$schema": "https://json-schema.org/draft/2020-12/schema",
  "$id": "https://sandra.local/schemas/policy-decision.schema.json",
  "title": "PolicyDecision",
  "type": "object",
  "additionalProperties": false,
  "required": [
    "apiVersion",
    "kind",
    "metadata",
    "subjectRef",
    "capabilityRef",
    "policyRefs",
    "evidenceRefs",
    "outcome",
    "conditions",
    "limits",
    "reasons",
    "decidedAt",
    "expiresAt"
  ],
  "properties": {
    "apiVersion": {
      "const": "governance.sandra.io/v1"
    },
    "kind": {
      "const": "PolicyDecision"
    },
    "metadata": {
      "type": "object",
      "additionalProperties": false,
      "required": [
        "id",
        "revision"
      ],
      "properties": {
        "id": {
          "type": "string",
          "pattern": "^dec_[a-z0-9]{16,64}$"
        },
        "revision": {
          "type": "integer",
          "minimum": 1
        }
      }
    },
    "subjectRef": {
      "type": "string"
    },
    "capabilityRef": {
      "type": "string"
    },
    "policyRefs": {
      "type": "array",
      "items": {
        "type": "string"
      },
      "minItems": 1,
      "uniqueItems": true
    },
    "evidenceRefs": {
      "type": "array",
      "items": {
        "type": "string"
      },
      "minItems": 1,
      "uniqueItems": true
    },
    "outcome": {
      "enum": [
        "autonomous",
        "conditional_autonomous",
        "escalate",
        "denied"
      ]
    },
    "conditions": {
      "type": "array",
      "items": {
        "type": "string"
      },
      "uniqueItems": true
    },
    "limits": {
      "type": "object"
    },
    "reasons": {
      "type": "array",
      "items": {
        "type": "string"
      },
      "minItems": 1
    },
    "decidedAt": {
      "type": "string",
      "format": "date-time"
    },
    "expiresAt": {
      "type": "string",
      "format": "date-time"
    }
  }
}
